{
  "version": "1.0",
  "last_reviewed": "2026-06-21",
  "status": "contract_assets_only_not_runtime_loaded",
  "style_packs": [
    {
      "id": "founder_explainer",
      "title": "Founder Explainer",
      "file": "founder_explainer.md",
      "best_use": "Founder-led lessons, startup decisions, operator reflections, and practical business explanations.",
      "poor_use": "Highly comedic content, anonymous mystery stories, or posts that need fast meme timing.",
      "pacing": "Measured hook, steady middle, reflective close.",
      "visuals": "Founder workspace, notes, product sketches, support queues, abstract dashboards, no readable UI text.",
      "captions": "Clear lesson-first copy with a practical takeaway.",
      "transitions": "Simple cuts, push-ins, and match cuts between work artifacts.",
      "music": "Warm minimal piano or soft pulse under narration.",
      "sfx": "Sparse desk, keyboard, paper, or subtle notification textures.",
      "voice": "Grounded founder reflection, credible and calm.",
      "avatar_policy": "Avatar not needed by default; synthetic presenter allowed only if transparent and client-approved.",
      "template_needs": ["core lesson", "founder point of view", "specific operating moment", "practical takeaway"],
      "negative_rules": ["Do not invent traction, customer names, revenue, or proprietary details.", "Do not show readable customer data or product UI."],
      "rule_sets": ["brand_safety", "visual_consistency", "voice", "music_sfx", "editing"]
    },
    {
      "id": "cinematic_problem_solution",
      "title": "Cinematic Problem Solution",
      "file": "cinematic_problem_solution.md",
      "best_use": "Narratives that define a clear pain, reveal stakes, and resolve with a product, process, or insight.",
      "poor_use": "Pure tutorials, jokes, or content where no meaningful transformation exists.",
      "pacing": "Tension-forward opening, rising friction, clean solution turn, confident close.",
      "visuals": "Problem state, friction details, contrast frames, and resolved outcome with consistent cinematic realism.",
      "captions": "Problem then solution phrasing with one concrete promise that the source supports.",
      "transitions": "Contrast cuts, match cuts, and reveal transitions.",
      "music": "Subtle cinematic pulse that lifts at the solution turn.",
      "sfx": "Low-impact transition hits and restrained environmental accents.",
      "voice": "Confident, clear, and slightly dramatic without hype.",
      "avatar_policy": "Usually no avatar; use presenter only when the solution needs an explicit human guide.",
      "template_needs": ["problem", "stakes", "solution", "before state", "after state"],
      "negative_rules": ["Do not manufacture urgency or guaranteed results.", "Do not overstate the solution beyond evidence."],
      "rule_sets": ["brand_safety", "visual_consistency", "voice", "music_sfx", "editing", "platform_publishing"]
    },
    {
      "id": "fast_reel_hook",
      "title": "Fast Reel Hook",
      "file": "fast_reel_hook.md",
      "best_use": "Short tactical tips, creator education, quick checks, and high-retention social advice.",
      "poor_use": "Sensitive stories, reflective founder pieces, or complex topics needing nuance.",
      "pacing": "Immediate hook, short beats, fast cuts, crisp close.",
      "visuals": "Phone previews, editing timelines, abstract creator workflow, hands, and punchy motion.",
      "captions": "Compact action-first captions with one direct instruction.",
      "transitions": "Jump cuts, snap cuts, whip cuts, and hard cuts.",
      "music": "Dry percussion, tight clicks, or fast clean pulse.",
      "sfx": "Short taps, swipes, cuts, and edit hits used sparingly.",
      "voice": "Fast, clipped, direct, and energetic.",
      "avatar_policy": "No avatar by default; creator hands or abstract UI are preferred.",
      "template_needs": ["one tactic", "why it matters", "3-4 step flow", "quick close"],
      "negative_rules": ["Do not promise views, growth, or algorithm outcomes.", "Do not overload scenes with explanation."],
      "rule_sets": ["brand_safety", "visual_consistency", "voice", "music_sfx", "editing"]
    },
    {
      "id": "product_demo_walkthrough",
      "title": "Product Demo Walkthrough",
      "file": "product_demo_walkthrough.md",
      "best_use": "Product flows, feature walkthroughs, workflow explainers, and SaaS demos.",
      "poor_use": "Emotional brand films, testimonials without product detail, or meme formats.",
      "pacing": "Clear step-by-step progress with a short hook and benefit close.",
      "visuals": "Abstract dashboards, blurred UI cards, workflow states, handoff moments, and product-adjacent motion.",
      "captions": "Benefit and workflow clarity, not feature stuffing.",
      "transitions": "Slides, morphs, and clean step transitions.",
      "music": "Clean optimistic synth or light pulse.",
      "sfx": "Soft clicks and state-change accents, never noisy.",
      "voice": "Calm product walkthrough with plain language.",
      "avatar_policy": "Presenter optional only if the demo needs a guide; avoid real likeness without consent.",
      "template_needs": ["user problem", "workflow steps", "key benefit", "safe product claims"],
      "negative_rules": ["Do not show readable proprietary UI or customer data.", "Do not claim integrations or metrics not in the payload."],
      "rule_sets": ["brand_safety", "visual_consistency", "voice", "music_sfx", "editing", "platform_publishing"]
    },
    {
      "id": "before_after_transformation",
      "title": "Before After Transformation",
      "file": "before_after_transformation.md",
      "best_use": "Workflow improvements, design upgrades, process changes, cleanup stories, and clear transformations.",
      "poor_use": "Stories where the after state is speculative or unproven.",
      "pacing": "Fast before state, clear turning point, satisfying after reveal.",
      "visuals": "Split contrast implied through sequencing, not split panels; messy-to-clean progression.",
      "captions": "Before, change, after in simple language.",
      "transitions": "Match cuts, wipes, and reveal cuts that show contrast.",
      "music": "Build from light tension to clean lift.",
      "sfx": "Small whooshes or reveal hits, restrained.",
      "voice": "Confident and practical, with momentum.",
      "avatar_policy": "No avatar by default; use process visuals first.",
      "template_needs": ["before state", "change made", "after state", "proof boundary"],
      "negative_rules": ["Do not fake before/after evidence.", "Do not imply a guaranteed transformation."],
      "rule_sets": ["brand_safety", "visual_consistency", "voice", "music_sfx", "editing"]
    },
    {
      "id": "client_testimonial_case_study",
      "title": "Client Testimonial Case Study",
      "file": "client_testimonial_case_study.md",
      "best_use": "Permissioned customer wins, anonymized case studies, and proof-backed service stories.",
      "poor_use": "Unverified outcomes, private client details, or content without approval to share.",
      "pacing": "Credibility-first hook, context, action, result, caveated lesson.",
      "visuals": "Anonymized client context, abstract metrics, team workflow, and proof-safe visuals.",
      "captions": "Outcome with context and no unsupported guarantee.",
      "transitions": "Clean documentary cuts and evidence-focused reveals.",
      "music": "Professional, restrained, optimistic.",
      "sfx": "Minimal; use only for evidence-card movement.",
      "voice": "Credible case-study narrator, measured and specific.",
      "avatar_policy": "Real client likeness requires consent; default to anonymized visuals or synthetic placeholders.",
      "template_needs": ["client consent status", "problem", "action", "result", "allowed proof"],
      "negative_rules": ["Do not reveal private client data.", "Do not invent testimonial quotes or metrics."],
      "rule_sets": ["brand_safety", "visual_consistency", "voice", "music_sfx", "avatar", "approval", "platform_publishing"]
    },
    {
      "id": "educational_mini_lesson",
      "title": "Educational Mini Lesson",
      "file": "educational_mini_lesson.md",
      "best_use": "Short explainers, frameworks, tactical lessons, definitions, and myth corrections.",
      "poor_use": "Heavy emotional stories, broad brand films, or content needing complex citations.",
      "pacing": "Hook, simple frame, 2-4 teaching beats, summary close.",
      "visuals": "Concrete examples, abstract diagrams without readable text, desk demonstrations, and simple visual metaphors.",
      "captions": "Saveable lesson summary with one practical action.",
      "transitions": "Clean chapter cuts and simple progression.",
      "music": "Light neutral bed that stays behind teaching.",
      "sfx": "Light emphasis taps or chapter hits.",
      "voice": "Clear teacher voice, concise and friendly.",
      "avatar_policy": "Presenter optional; no real likeness without consent.",
      "template_needs": ["lesson topic", "audience", "common mistake", "actionable takeaway"],
      "negative_rules": ["Do not overcomplicate with jargon.", "Do not present uncertain claims as settled facts."],
      "rule_sets": ["brand_safety", "visual_consistency", "voice", "music_sfx", "editing"]
    },
    {
      "id": "meme_relatable_pain_point",
      "title": "Meme Relatable Pain Point",
      "file": "meme_relatable_pain_point.md",
      "best_use": "Lightweight pain-point relatability, B2B humor, creator frustrations, and social-native observations.",
      "poor_use": "Sensitive topics, serious client proof, regulated claims, or trauma stories.",
      "pacing": "Fast setup, recognizable pain, quick exaggeration, light resolution.",
      "visuals": "Expressive situations, reaction shots, exaggerated workflow moments, no copyrighted meme templates.",